{
  "version": "0.1.0",
  "dataset": "Base USDC Synthetic Payment QA Fixtures",
  "not_for_production": true,
  "description": "Synthetic, no real signatures, no real private keys, no broadcast RPC.",
  "cases": [
    {
      "id": "happy-path",
      "description": "Exact 1 USDC native transfer, two agreeing finalized snapshots.",
      "assumptions": "All RPC views and order-binding attestations are invented input; no network checks.",
      "expected": "ACCEPT",
      "order": {
        "order_id": "order-happy-path",
        "network": "eip155:8453",
        "asset": "0x833589fcd6edb6e08f4c7c32d4f71b54bda02913",
        "recipient": "0x2222222222222222222222222222222222222222",
        "payer": "0x1111111111111111111111111111111111111111",
        "amount_atomic": "1000000",
        "decimals": 6,
        "binding_verified": true
      },
      "proof": {
        "network": "eip155:8453",
        "transaction_hash": "0x6d8d63b3882a05829e80ae7241f8c5f364f203b18738561767acc535f18ec5ec",
        "log_index": 0
      },
      "prior_claim_keys": [],
      "rpc_views": [
        {
          "provider": "synthetic-rpc-a",
          "chain_id": 8453,
          "available": true,
          "finalized_block": 1001,
          "receipt": {
            "transaction_hash": "0x6d8d63b3882a05829e80ae7241f8c5f364f203b18738561767acc535f18ec5ec",
            "status": "0x1",
            "block_number": 1000,
            "logs": [
              {
                "address": "0x833589fcd6edb6e08f4c7c32d4f71b54bda02913",
                "topics": [
                  "0xddf252ad1be2c89b69c2b068fc378daa952ba7f163c4a11628f55a4df523b3ef",
                  "0x0000000000000000000000001111111111111111111111111111111111111111",
                  "0x0000000000000000000000002222222222222222222222222222222222222222"
                ],
                "data": "0x00000000000000000000000000000000000000000000000000000000000f4240",
                "log_index": "0x0",
                "transaction_hash": "0x6d8d63b3882a05829e80ae7241f8c5f364f203b18738561767acc535f18ec5ec",
                "removed": false
              }
            ]
          }
        },
        {
          "provider": "synthetic-rpc-b",
          "chain_id": 8453,
          "available": true,
          "finalized_block": 1000,
          "receipt": {
            "transaction_hash": "0x6d8d63b3882a05829e80ae7241f8c5f364f203b18738561767acc535f18ec5ec",
            "status": "0x1",
            "block_number": 1000,
            "logs": [
              {
                "address": "0x833589fcd6edb6e08f4c7c32d4f71b54bda02913",
                "topics": [
                  "0xddf252ad1be2c89b69c2b068fc378daa952ba7f163c4a11628f55a4df523b3ef",
                  "0x0000000000000000000000001111111111111111111111111111111111111111",
                  "0x0000000000000000000000002222222222222222222222222222222222222222"
                ],
                "data": "0x00000000000000000000000000000000000000000000000000000000000f4240",
                "log_index": "0x0",
                "transaction_hash": "0x6d8d63b3882a05829e80ae7241f8c5f364f203b18738561767acc535f18ec5ec",
                "removed": false
              }
            ]
          }
        }
      ]
    },
    {
      "id": "case-insensitive-address",
      "description": "Mixed-case input address still matches ERC-20 fields.",
      "assumptions": "All RPC views and order-binding attestations are invented input; no network checks.",
      "expected": "ACCEPT",
      "order": {
        "order_id": "order-case-insensitive-address",
        "network": "eip155:8453",
        "asset": "0x833589fcd6edb6e08f4c7c32d4f71b54bda02913",
        "recipient": "0x2222222222222222222222222222222222222222",
        "payer": "0x1111111111111111111111111111111111111111",
        "amount_atomic": "1000000",
        "decimals": 6,
        "binding_verified": true
      },
      "proof": {
        "network": "eip155:8453",
        "transaction_hash": "0x19c69e719d7f345e6f29b778f63893a83a4507394e077329744b279289f9e91c",
        "log_index": 0
      },
      "prior_claim_keys": [],
      "rpc_views": [
        {
          "provider": "synthetic-rpc-a",
          "chain_id": 8453,
          "available": true,
          "finalized_block": 1001,
          "receipt": {
            "transaction_hash": "0x19c69e719d7f345e6f29b778f63893a83a4507394e077329744b279289f9e91c",
            "status": "0x1",
            "block_number": 1000,
            "logs": [
              {
                "address": "0x833589fcd6edb6e08f4c7c32d4f71b54bda02913",
                "topics": [
                  "0xddf252ad1be2c89b69c2b068fc378daa952ba7f163c4a11628f55a4df523b3ef",
                  "0x0000000000000000000000001111111111111111111111111111111111111111",
                  "0x0000000000000000000000002222222222222222222222222222222222222222"
                ],
                "data": "0x00000000000000000000000000000000000000000000000000000000000f4240",
                "log_index": "0x0",
                "transaction_hash": "0x19c69e719d7f345e6f29b778f63893a83a4507394e077329744b279289f9e91c",
                "removed": false
              }
            ]
          }
        },
        {
          "provider": "synthetic-rpc-b",
          "chain_id": 8453,
          "available": true,
          "finalized_block": 1000,
          "receipt": {
            "transaction_hash": "0x19c69e719d7f345e6f29b778f63893a83a4507394e077329744b279289f9e91c",
            "status": "0x1",
            "block_number": 1000,
            "logs": [
              {
                "address": "0x833589fcd6edb6e08f4c7c32d4f71b54bda02913",
                "topics": [
                  "0xddf252ad1be2c89b69c2b068fc378daa952ba7f163c4a11628f55a4df523b3ef",
                  "0x0000000000000000000000001111111111111111111111111111111111111111",
                  "0x0000000000000000000000002222222222222222222222222222222222222222"
                ],
                "data": "0x00000000000000000000000000000000000000000000000000000000000f4240",
                "log_index": "0x0",
                "transaction_hash": "0x19c69e719d7f345e6f29b778f63893a83a4507394e077329744b279289f9e91c",
                "removed": false
              }
            ]
          }
        }
      ]
    },
    {
      "id": "wrong-order-network",
      "description": "Order asks for an unsupported EVM network.",
      "assumptions": "All RPC views and order-binding attestations are invented input; no network checks.",
      "expected": "WRONG_NETWORK",
      "order": {
        "order_id": "order-wrong-order-network",
        "network": "eip155:1",
        "asset": "0x833589fcd6edb6e08f4c7c32d4f71b54bda02913",
        "recipient": "0x2222222222222222222222222222222222222222",
        "payer": "0x1111111111111111111111111111111111111111",
        "amount_atomic": "1000000",
        "decimals": 6,
        "binding_verified": true
      },
      "proof": {
        "network": "eip155:8453",
        "transaction_hash": "0x8a741ffa4f036a153bac6e86c3dadab256b7df69977cb0e0bc44f442b7a77732",
        "log_index": 0
      },
      "prior_claim_keys": [],
      "rpc_views": [
        {
          "provider": "synthetic-rpc-a",
          "chain_id": 8453,
          "available": true,
          "finalized_block": 1001,
          "receipt": {
            "transaction_hash": "0x8a741ffa4f036a153bac6e86c3dadab256b7df69977cb0e0bc44f442b7a77732",
            "status": "0x1",
            "block_number": 1000,
            "logs": [
              {
                "address": "0x833589fcd6edb6e08f4c7c32d4f71b54bda02913",
                "topics": [
                  "0xddf252ad1be2c89b69c2b068fc378daa952ba7f163c4a11628f55a4df523b3ef",
                  "0x0000000000000000000000001111111111111111111111111111111111111111",
                  "0x0000000000000000000000002222222222222222222222222222222222222222"
                ],
                "data": "0x00000000000000000000000000000000000000000000000000000000000f4240",
                "log_index": "0x0",
                "transaction_hash": "0x8a741ffa4f036a153bac6e86c3dadab256b7df69977cb0e0bc44f442b7a77732",
                "removed": false
              }
            ]
          }
        },
        {
          "provider": "synthetic-rpc-b",
          "chain_id": 8453,
          "available": true,
          "finalized_block": 1000,
          "receipt": {
            "transaction_hash": "0x8a741ffa4f036a153bac6e86c3dadab256b7df69977cb0e0bc44f442b7a77732",
            "status": "0x1",
            "block_number": 1000,
            "logs": [
              {
                "address": "0x833589fcd6edb6e08f4c7c32d4f71b54bda02913",
                "topics": [
                  "0xddf252ad1be2c89b69c2b068fc378daa952ba7f163c4a11628f55a4df523b3ef",
                  "0x0000000000000000000000001111111111111111111111111111111111111111",
                  "0x0000000000000000000000002222222222222222222222222222222222222222"
                ],
                "data": "0x00000000000000000000000000000000000000000000000000000000000f4240",
                "log_index": "0x0",
                "transaction_hash": "0x8a741ffa4f036a153bac6e86c3dadab256b7df69977cb0e0bc44f442b7a77732",
                "removed": false
              }
            ]
          }
        }
      ]
    },
    {
      "id": "wrong-proof-network",
      "description": "Proof network claims Ethereum L1.",
      "assumptions": "All RPC views and order-binding attestations are invented input; no network checks.",
      "expected": "WRONG_NETWORK",
      "order": {
        "order_id": "order-wrong-proof-network",
        "network": "eip155:8453",
        "asset": "0x833589fcd6edb6e08f4c7c32d4f71b54bda02913",
        "recipient": "0x2222222222222222222222222222222222222222",
        "payer": "0x1111111111111111111111111111111111111111",
        "amount_atomic": "1000000",
        "decimals": 6,
        "binding_verified": true
      },
      "proof": {